Review ID,User Name,Review Content,Rating,Helpful Count,App Version,Review Date
06cdc51b-f065-4bbf-9652-4b0c7bf5fee9,Josue Ayala,"I'm just trying to feel better, and listening to water flowing help me to relax also the meditations included help you to realize there's people out there wanting to help.",5,0,6.61,2025-01-30 09:36:45
58e10101-858c-4db3-ac53-6414ab6ffd2e,Sharon,I love this check-in to get spirit right for the day.,5,0,6.61,2025-01-30 09:04:02
7ca2cd28-3714-47e2-aee3-838bb1997bf6,Ali Olshan,I love the fact that they are so flexible and just they interface. music is so good,5,0,6.62,2025-01-30 07:22:45
31adf1d7-c1bb-4523-a263-83c3a310180c,Owen Johnson,"I like the sleep story content a lot. The app has too many extras, like streak and habits, etc. I have to dismiss two screens to get to the content. We're missing some core features, like listening on a smart speaker, especially considering they just dropped their Sonos integration.",3,31,6.61,2025-01-30 07:17:18
db8108b2-c3b2-44d5-8c5e-da211c399ef3,Nick N,"Useless, just collect you data and run only in premium version after update",1,0,6.60.1,2025-01-30 02:18:48
dfc02db4-ad5a-4af6-9d8e-09014b409621,Sea Sapphire,Have to pay to use. I only need it once in a while...,1,0,,2025-01-30 00:00:54
5e4fa07f-62f3-4a1c-bc00-e680aec4958d,Nadia Swanepoel,Best sleep ever. i am lookong forward to going to bed just to listen to the rain,5,0,6.61,2025-01-29 23:41:06
6cf90720-f245-45b8-8f4c-1c1cf59b1228,Pixel Panduh,"Not worth is go to youtbe for sleep music, videos , stories and frequencies those are free and you can be as long as 8 hours even 12. Everything is locked here unless you pay and isn't even that long",1,0,6.61,2025-01-29 23:23:40
c52809e5-7942-4b91-9682-da8f939f44c2,Archana Singam,I will highly recommend this app for your mental peace in personal and professional life.,5,0,6.61,2025-01-29 22:32:06
4c1dd395-6ff1-4596-920d-5f8fff525ef9,Ashi,Cant even try it adds popping up everywhere. So irritated. More stressed than ever.,1,0,6.61,2025-01-29 22:29:54
b17b54db-e3fa-4054-b000-1e37dc936c9c,Ember,love it,5,0,6.61,2025-01-29 21:14:52
505c7b3b-69cd-49aa-bb21-f2f227b08213,Angelita Sanchez,I love this app. It comes in handy at work.,5,0,6.61,2025-01-29 16:09:07
055e35c3-8f57-4f31-94ed-b319b831e87a,Marie Pringle,It works keeps me calm.,5,0,6.61,2025-01-29 14:32:51
dd1fe121-4508-47a7-8906-54806c087c18,Anna,"Along with other practices, calm has helped me navigate different steps to take myself out of my worry and into being mindful and present.",5,0,6.61,2025-01-29 11:57:48
170215b7-2c97-4c4b-8f1a-98ec9804b89b,Caleb White,"I tried it the first time, and it worked. Meditation to my breathing and eyes closed, ears open to the sounds of water and life around, and the woman's voice guiding me, as she was my guide to relaxing my mind and clearing my minds day perspective. Thank you. Genuinely and sincerely, Caleb",5,0,6.61,2025-01-29 09:45:59
ce5354c7-c3cf-41d9-8f5a-b7dec9b02b07,Angela Baker,Need something to ease .y mind yet stimulate it too. Like the diversity and idea behind this app. I only hope it's not all payment required.,5,0,,2025-01-29 06:34:31
67814485-906e-4781-9ea7-a6d361d71f14,Tanja Stevenson-Saga,Great app for relaxation,5,0,6.60.1,2025-01-29 03:19:07
f19892b4-007d-4edf-a562-0b87b8859638,benedicta adingelah,it calms my spirit and makes me feel content.,5,0,6.61,2025-01-29 00:47:13
e8dbb0b7-742f-4e48-b547-66fbcd6bb075,Gretchen Stine,very relaxing,5,0,6.61,2025-01-28 22:45:52
b5d8457b-e079-418b-9e1f-02766e4df7e9,Stephanie Hervan,Can't even get it to download,1,0,,2025-01-28 22:33:11
02794ebd-1d17-40de-8121-dbe5e679aeab,Natoya Evans,wonderful,5,0,6.61,2025-01-28 22:02:26
bf83d89e-e2c4-4399-ae5f-0fe7e23ba454,John Kuczek,Cancelling subscription is difficult if not impossible in the app.,1,0,,2025-01-28 21:00:14
b9bdf7c1-7b9f-44ba-95fe-1ca78e205d25,Kathy Conway,Free option is horrific,1,0,,2025-01-28 17:38:15
0ed077e2-555f-48ea-9476-562fde38d323,Sue,"Do NOT get it, it is basically impossible to get rid of the free trial. DO NOT DOWNLOAD",1,0,,2025-01-28 16:35:18
3754f63e-a831-43c2-a4b8-3b59f3781aa9,Carol Rosales,"calm is such a wonderful app. to have, believe me , it helps.",5,0,6.61,2025-01-28 12:25:40
b3c04404-6307-434a-8c80-07494b637101,Rosette Abasolo,Please I need a refund... I'm seeking for something can help with my mental issue.. but you make it worst.. you charge me without even asking me you automatically deducted a 1 year subscription? This is a total scam apps,1,1,6.61,2025-01-28 06:20:33
aa7f6f54-a4d5-4e6d-9555-5a2866640bad,dona church,I love it it's so calming,5,0,5.13,2025-01-28 02:27:40
25984adb-aef6-4f4b-8f8a-c03f9a72cdad,Stephen Adams (Deadbars),really good app helps with sleep,5,0,6.61,2025-01-28 00:48:19
cf673e2d-21e0-4ba0-9a5b-422f465cd61f,Abiola Ahmad,it's a good meditation app I've ever seen,5,0,6.61,2025-01-28 00:09:14
ec0b5577-37d5-44f1-a2d3-f98306149803,Bridgett Hughes,I am a new customer and I am excited & happy to say I am 100% satisfied. I am looking forward to going to sleep tonight and now. thank YOU! Calm...,5,0,,2025-01-27 11:22:53
bef4a1bf-9440-4209-810e-5e42a1816cb4,Frieda S.,"This app claims to be ""Free"" but offers a 7 day trial.",2,1,6.61,2025-01-26 21:08:02
22613858-1a01-4248-8b10-14dbc98c57ed,CJ S,"App startup is deceitful. Supposed to be ""free"" to use, but as soon as you start it they shove a page in your face to subscribe without any easy way to see how to start it and comb through it free. Basically deceiving lots of people to agree to terms of subscriptions just to get into it. They hid the way to get around the startup. Then if you manage to figure it out without subscribing you'll soon see probably 95% or more is hidden behind their paywall. Actually causing stress rather then relief",1,107,6.61,2025-01-26 19:52:23
df7e2f8d-cbf7-441d-8a4a-c6f6cd0d2f3a,Damien Walton,relaxing,5,0,6.61,2025-01-26 18:55:40
8758a3df-7460-4b11-a1a0-e55d6e721f9f,Danny FCRB,Almost everything is with money... 👎,1,0,6.61,2025-01-26 18:05:59
e3404695-0c20-42c4-a691-93b151b1f0e0,Janis Jackson,soothing,5,0,6.61,2025-01-26 17:44:09
927dcae4-c8a6-49f4-8311-09e01257e7c1,Tamara Griffin,Great for winding down. Used for two years to help create extra time for your busy schedule. Daily reminders for help with extracurricular activities for more unwinding your brain. Awesome for free listening to help prep your body to rest. Gives options of free link for continued use. Very recommended!,4,0,,2025-01-26 17:43:10
86357ae0-bb36-44ef-8d27-e5848a7ff629,Jessica Moore,"I enjoyed my moment of relaxation. I remember that woman's voice from last time, months ago, when I listened more often. Thankyou.",5,1,6.61,2025-01-26 16:22:42
83a1dd30-ec4f-4e52-ae38-a236c3b17b6a,Aaliyah 123,"I would love to have the full features but I cannot afford, you need to pay for the features in this app. It's a shame because I would love this app if i didn't need to listen to 3 uses for the free feature because then I have to pay after the 3 listening. Overall it's a great app if you need time to yourself and relax. It really helps especially with the soundscapes of streams of water or rain I love it it's so calming! Please Calm do consider a free features as well",3,12,6.61,2025-01-26 16:06:19
3cb0873b-c0f9-402f-b4e1-275e11ee59c6,Maria Grace Alejandrino,Calm is great for body and mind,5,0,6.61,2025-01-26 15:18:33
1cf566de-cce7-42d4-8f15-72e43d16a3f7,KeSh,could more videos unlock at least some to get full benefits from it to help alittle more than charging.,1,3,6.61,2025-01-26 13:42:19
1df601ed-5ba6-48e3-8e1b-dd70e949ba8a,Rachel Anderson (Raeford),I've had this app installed for a couple weeks now and it's amazing in helping my journey to a better life. I love everything it has to offer. I only wish I could afford to buy it.,5,0,6.61,2025-01-26 11:41:04
78c754df-f6f4-46e0-946a-e40ca1e4f062,Lisa,I really feel this Is an essential app for sleep and mental health.,5,0,6.61,2025-01-26 09:00:39
caa06ab5-c406-41ad-885f-eb3b641f3296,Jaco Sonnier,love it until the sounds switches to something else while I'm in deep sleep.,3,0,6.61,2025-01-26 07:48:06
1c96a3c2-d90c-40c2-8b61-2867f116504b,Caesar Sigala,This is definitely going to come in handy this year. Recommend to everyone.,5,0,6.61,2025-01-26 04:36:50
245038c6-44a6-450c-8047-34d9d0b8e3ed,A Google user,Glitchy AF,1,0,6.61,2025-01-26 02:09:23
26ab8d8f-f4b1-4ac7-9fd9-cb8a181eb869,Moth,I love calm! Will say that it's not worth it without the subscription though. I have one complaint: the heartbeat soundscape specifically is too quiet compared to the other soundscape. But that's it! Have a nice day!,5,2,6.61,2025-01-26 00:53:12
52f8c825-4cda-413b-beea-7a00f8d862f0,Jim Burkhart,The Ocean sound is very relaxing.,5,0,,2025-01-25 22:16:47
4f3e3275-2e3e-4dae-8033-4079074d84c5,W M,Lol too expensive,1,0,6.61,2025-01-25 19:40:44
9fd4d7fe-e900-4c83-80b3-3c83ea9fa6bb,Elvira T,👌👌👌,5,0,6.61,2025-01-25 19:02:52
bd4170aa-477a-4d3d-881c-bc446b1a268c,Kathy Hocher,Love Sam Heughan's voice!,5,0,6.61,2025-01-25 12:01:31
d6378dff-5d36-4bf8-a63d-4fdc808e933d,Michelle W,This app costs WAY too much for me to receive as many 'not available' notifications as I do. Infuriating.,1,1,6.61,2025-01-25 11:52:12
3819ca68-9fa7-4fc6-8daf-bad44299a58c,Tenadore Anderson,Became a definite everyday on first listen,5,0,6.61,2025-01-25 11:22:20
9165574f-0c01-4ccc-b0d8-35e88adabafd,Andrew SFV 818,feeling of peace,5,0,6.61,2025-01-25 08:23:35
7b2f8dd9-808d-419f-94b3-fe908a5b0e3b,Sergio Alvarado,Love this app. It has really helped with my sleep.,4,0,6.61,2025-01-25 08:06:11
fcdc97dc-f828-43d1-8416-e81205929f2a,Ian Blandford,"The best bit of this app was the sleep stories which were very good at helping me fall asleep after five minutes. Then they decided to add a ""gong"" chime to a notification to ask you if the story worked waking me straight back up. Unusable now.",1,1,6.61,2025-01-25 05:54:57
f23191a7-6cbb-4ae1-adf4-49e00e453be4,Pawel Kaczmarek,Brilliant stuff there. 🤘,5,0,6.61,2025-01-25 05:17:19
6a8444d1-afb7-425b-a083-c0cc6e8c6725,RS M,Use it for soundscapes. I really wish it had Christian hymns and ambient church music. App seems very anti Christian with the large amount of mysticism and no Christian content.,2,0,6.61,2025-01-25 02:20:51
544c0e0d-8392-47d8-b3f1-de548788427b,Brett,Monthly subscription required,1,2,,2025-01-24 23:08:17
ce02c91b-580c-440a-92dc-1cc6ecb32227,Alon Botvinik,"This App, while ""allowing"" you to cancel subscription before the trial ends, in fact did not do that, and I got charged without permission. I have disputed the charge at this point after Support does not answer their tickets even after 5 business days.",1,4,6.61,2025-01-24 11:28:56
6ebe5fa6-45bc-4918-91a0-8e536d597d5b,Reeta Kashyap,good meditations,5,0,,2025-01-24 11:25:19
9007c35e-fb2b-4425-a80f-0ac68fc675e5,Omar Fernández,"I was gifted a trial. For a mindfulness app, it is using obnoxious tricks to get subscriptions. First, it automatically put me into a plan that charges $70 a year if I forget to cancel. Second, the cancelation flow is horrible. If I'm cancelling, don't make me say it in 4 different ways. The cancellation buttons are tiny and don't work, I had to tap randomly trying to find a tap to cancel. Lastly, I shouldn't have to cancel for a 40% off. Be more honest. I'll stick to Insight Timer.",1,14,,2025-01-24 06:37:04
3793bb10-d32f-4f18-8e31-dc9f9777cb13,Yadira Polanco,invest in your mental health. this app is wonderful,5,0,6.61,2025-01-24 04:49:55
13827097-63a0-411f-9780-cd5e5eb7ece0,METAL HEAD,Stupid app the only thing free about this app is the download everything else is premium,1,2,,2025-01-24 04:28:21
c64eb917-c920-4b4b-90ce-a43d0704dc86,Ahmed Obaidi,Not working 403 error ehen i start the app,1,1,,2025-01-23 21:58:30
8e0a4fe8-4530-4c40-a61f-436d101d913c,Diana Sisseck,"no ""forgot password"". Constant pressure to subscribe to premium, or pay to gift to someone else. Can't find the 30-second calm count down. Hard to look with all the barrage of upgrade to premium or gift to a friend adverts.",2,2,6.61,2025-01-23 14:02:23
619bad92-082f-49b6-8e0e-133420e539db,Mhotep,"Good app, lots of varied content 😊",5,0,6.61,2025-01-23 12:31:58
e4b59a18-3076-4e83-88a0-8ed258db2cc9,Proxymaster,"Do not get this. It will do the opposite of calming you down. The way to cancel a subscription is abnoxiously bad. It doesn't even work in the app itself. I was gifted a 30-day trial for Christmas from my mother and thought my cancellation went through, but it did not, and I was billed. Use youtube calming music. It's free and doesn't have people talking to you or abruptly shutting off the entire time you're trying to sleep.",1,88,6.61,2025-01-23 12:01:17
aae8cef4-70c3-44a7-8817-f007727e2d79,Marilyn Bowes,"This helped me to know what I need. to do to get past my low mood and low energy. Thank you, Jay!",5,1,6.61,2025-01-23 09:21:07
1fe0db3c-f12d-4ea2-bef6-73b8c178aae0,patty shokrani,Stories w visual imagery...need I say more,5,0,6.59,2025-01-23 05:25:43
93a74cb6-2203-43c1-bb5a-24b6f03501ab,Carolyn Hartung,Couldn't live without it excellent,5,0,6.61,2025-01-23 05:17:07
3c7fac85-2eec-4b67-81f9-e8e4352e2f76,Terri Sullivan,This is my favorite app for relaxation and sleep. There's a wide variety of sounds add things you can customize.,5,5,6.61,2025-01-23 01:03:57
afbe6cd7-96ae-4dc0-9c3b-4aeba6d2fe28,Jesse Welsh,Not a good app you have to pay for everything and every sound that u want to listen to this app makes you pay for and when I download the calm app before calming music was free and now it's making you pay for everything this app is a joke and the people that developed the app needs to make listening calming music free again not making you pay to listen to an app that used to be free for listening and what a joke of an app,2,0,6.61,2025-01-23 00:39:53
1b2e2306-41a0-46f0-b9ed-d43d603b5a38,Matt Rannenberg,"I began using calm through my Samsung health app, and had to unlock the premium version! I was able to access a lot which was great, but this app has revolutionized my meditation practices. I dabbled a lot and always had one foot in and one foot out over the years, never being consistent. This app offers such digestible content and so many helpful insights, I have already logged over 14 hrs of meditation in just under a month! Highly recommend.",5,296,6.61,2025-01-22 23:59:43
5ad5ef41-c01a-4dc0-b174-0c6b31a69057,Emilie Smith,Amazing and helpful,5,0,6.61,2025-01-22 21:16:35
9d44061b-6502-49b5-b4fb-c16d38e97fe0,G W,"Great Content, Hard To Keep Organized. The variety of topics & coaches ensures that ANY aspect of your life situation you need help with can be addressed and expanded on by a calming voice that suits your needs. The unique cadence, format, and perspective of each contributor ensures a good fit for your personal style. I enjoy finding new ones almost every week and the depth here is surprising. But, all this content can be hard to find when you need it. A more customizable Home Screen, w",3,3,6.61,2025-01-22 19:04:12
3d646966-8bcc-4b90-a909-7693f989ec21,David Butler,I find Insight Timer app to be much better.,1,0,,2025-01-22 18:10:34
86ff2230-8157-49b0-aab7-4d02fdb9ee95,Tre T,"Waste of battery, the app shuts off when the screen goes black. If I could give them negative stars I would, and change the name from calm to frustrating",1,1,6.60,2025-01-22 15:16:19
d52cba5f-89aa-4883-8c67-eedcdf6acda0,Tingwei Adeck,awesome creation thanks gang.,5,0,6.61,2025-01-22 10:51:58
2336b104-3d8d-4975-aa3f-513c61b44647,Natalia Sánchez Montealegre,its lovely,5,0,6.61,2025-01-22 07:54:28
48eb2ed8-8c20-4b08-b28a-7fa5f3d393a0,michelle baden,I cannot opn this app on my kindle fire. Its downloaded and thr opening screen comes on and then it disappears?,1,2,6.61,2025-01-22 07:11:34
782d181d-4944-4b14-9871-3477a02427ea,CON AGATHO,perfect,5,0,6.60.1,2025-01-22 01:20:14
5e1eb878-c04c-4dd6-ae97-4dde064fc0e2,Thandie Phakati,This is exactly what I needed. I'm happy to have this on my journey of self discovery.,5,0,6.61,2025-01-22 00:45:06
5b39c8df-260a-4a7a-a7bc-ad410fd04d51,Shane Rhoads,Good,5,0,6.61,2025-01-21 18:56:47
50263720-fde3-40d0-878e-415e591c6d4e,Anne Levingston (Ari),"I subscribed to Calm for 1 month. 12/30/2021, I paid for a 1-year subscription. January 2022, I was offered a lifetime subscription for $34.95, which I ourchased. May 2022, I received a notice from Google Play, that my subscription expired. I contacted Google support and they referred me to Calm. The website was extremely slow and there wasn't a category under which to request support for billing issues, so I had to submit my request under another one. Calm never replied to my request.",1,12,5.37.1,2025-01-21 18:14:19
8e1c841d-caf3-4dbf-a94a-3ac7121b6498,Lena,relaxing 😎.,5,0,6.60.1,2025-01-21 16:24:56
80ee6549-d07c-4555-ac2a-1b58806a76a7,Jessica Powers,"I especially love Daily Trip. It's like a daily meditation and therapy session rolled into one. Thank you, Calm ❤️",5,0,6.61,2025-01-21 13:22:36
bcc30be4-56cc-41c9-8b3d-9437456b0493,mik hague,Is there any way to increase the volume. Even on full I have to have my phone quite near to hear it. The daily Jay especially? Headphones aren't always wanted. No problem with my other apps only this one 🤔,3,132,6.61,2025-01-21 10:43:10
a374fe63-8ef4-41a7-b7d3-23782fed8a52,Felicity Bézard,Maybe there's some good stuff but the app is so busy and overwhelming I can't find anything,2,0,6.61,2025-01-21 10:39:21
4029d312-6fd9-459e-a1b7-03ec983198f1,RGV RGV,PapVol Vlpp,3,0,6.61,2025-01-21 05:15:48
cdd5df96-77b0-4c32-bd96-7f146c42d4f9,Naren,Previously this offered some free music which was good. Now everything is behind paywall,1,0,5.13,2025-01-20 22:52:49
6eecaa17-caf3-445c-8929-cb5edbe59ee3,Sun Flower,Good Exlirence,5,0,,2025-01-20 20:18:11
4690a4b4-a328-4525-a75c-31ab1f0319b4,Elvin Rillo,"Terrible app. Excellent content. If you can endure navigating through the app, or can find third-party tutorials, you'll find great content. If you don't get distracted by the app constantly trying to get you to help them with marketing, you'll find the meditations helpful.",3,3,6.61,2025-01-20 16:34:38
74d2b773-40f4-4320-b992-333b36eb2429,Family Catnach,"Was ok (although navigation is poor). But, since the update yesterday the app won't cast to my other speakers, the loader just spins continuously. All other sound/music apps are casting fine from the same device.",3,4,6.61,2025-01-20 15:10:55
71357b9c-fe7f-4a50-b890-185b4fc4cbde,Rey Pj Indus,What a disappointing app you need to pay before you can use it. 👎,1,0,,2025-01-20 14:26:38
20823828-8d6f-4cb2-b8bd-9fa7e78c8de5,Ceal Craig,"I was so hoping to like this because it provided different types of meditation to help go to sleep, get back to sleep as well as during the day. Listed as a Google recommended app, so i trusted it. But every time I tried it, I experienced technical issues on my Android. Last night it locked up my phone and I had to reboot AND going to do I have not even opened it up for several days. So I canceled my subscription after now only 2 weeks I think. I'll have to go look for something else.",2,6,,2025-01-20 12:24:12
60018620-be86-4c3e-b827-815b8ed954ad,Charlese M,While this app is helpful the navigation is needlessly difficult. Why would an app that's supposed to help me be calm force me to hunt for the content I'm looking for? For the love of God add a freaking menu!,3,2,6.61,2025-01-20 08:14:37
0a53a947-e836-46e5-80d0-4bf7da38a783,Mohsen Za,Not free so fake,1,0,6.61,2025-01-20 06:25:05
884916e8-bd8c-4ca3-818d-482266e20713,Dakeeta Hatcher,"I love this app. I've been using it for a few years. I would give it 5 stars, but they need to add some new sleep stories. They used to add more frequently. I'd like to see more additions and new narrators. Please continue to broaden the content and diversity of the stories and narrators.",4,0,,2025-01-20 05:51:42
d4147325-45f8-4eec-bb98-3cc7798256f5,Marie-Eve Charland,I have been using this app for a while now. It really helps me unwind and feel connected to myself. I have also been using the selection of sounds and stories to fall asleep when I am too overworked. I would say it's one of the best sleeping app on the market right now.,5,1,6.61,2025-01-20 05:05:39
ab371e6b-0574-4427-a86e-08e5559eee66,Nyiisha Chappell,good work,5,0,,2025-01-20 03:48:15
1f8b0e01-6c52-46aa-a393-7b1719005328,Burchell Keys,Bad I wanted rain did not give as advertised,2,0,6.61,2025-01-20 02:30:45
22bc7e1a-3783-40c1-92f6-42ac2b06e76c,Lesia N.Greene,I like please make more,5,0,6.61,2025-01-19 22:15:31
86835ca3-7a81-4b75-9066-baa0755d6907,Sherri N,Update - i was gifted a free 1 month trial. I made sure that I logged in 2 days before the end and cancelled. They still tried to charge me - and i just went in and tried to cancel again. Stop trying to defraud people. --- For a free app almost nothing is free. $60/yr is excessive for what I used it for. I now just listen to read audio on vimeo.,1,8,6.61,2025-01-19 20:42:42
ae4b22bd-9dac-45b2-9568-7de9641c6620,Mat Hislop,Constant Up sells as a paid user....,2,0,6.61,2025-01-19 19:55:11
4aec4e46-5bb7-4a62-8ccf-6dbd6fd53d9f,Audrey Collins,I have to do a 10 minute meditation for health insurance but calm removed all the generic meditations. I'm not paying for premium.,1,0,6.61,2025-01-19 18:52:10
da6b5eab-097c-4759-81f7-441b1e4dee47,Nicola Korzewska,Not good enough to pay for it,1,0,6.61,2025-01-19 14:32:45
f01ace13-da4f-40c3-895d-681519260164,Alyssa Alexander,AWFUL- they stole $ & wouldn't refund me,1,0,6.61,2025-01-19 14:26:54
b519fb88-2a68-43b5-925f-1afb0af0225f,Ljay,"Nothing is Free, rarely searches are successful. And no option to select free or short trials. Uninstalled, better off using YouTube via phone and WiFi.",1,0,,2025-01-19 10:04:23
60fabbb8-681b-4a10-9e6f-84850c19f60b,Hagai Hadad,"Simple and intuitive app, meditation requires practice",5,0,6.61,2025-01-18 22:03:03
12200873-d6b3-46e5-8aaa-c181677b22b8,Jacqueline Blackwelder,"I used to love this app, it Was great, now there aren't any meditations that are free, and there are other better apps",1,0,6.61,2025-01-18 20:43:58
4041ada8-456b-46c4-803d-991ec3a31bf2,Charlotte Henning,"A billing concern for Calm meditation App. Charged over $170.00 Dec ,13,31 and Jan. 2nd and Jan. 4th. All charges for Calm on one month bill via cc",3,0,6.61,2025-01-18 19:48:41
e688c681-e3a6-4fe0-b058-e2243b5e76df,MARK E,"I wish the settings could be changed before you actually start breathing. When I want to change parameters, it is not possible to do it before you click the play button. It does not make sense though, because you started breathing then you change the breathing parameters, am I supposed to hold breathing while I change it? 😄",3,0,,2025-01-18 12:27:21
4f3cf503-a568-4370-b81e-cd0acc9762f7,Lyonel Loundermon,awesome,5,0,6.61,2025-01-18 11:53:14
ddf62827-e72f-46c5-bb86-b83bb7d98bb2,Kaleigh Cross,"I loved listening to the free sleep stories BUT you then decided to lock them. Not user friendly. It's pretty much like ""oh you can't use this app unless you pay"" that's just straight exploiting.",2,0,,2025-01-18 07:36:45
071ab8c5-ec65-4c31-a708-93340d1c0b5d,Natalie Canning Reinartz,Would not have purchased if I'd known Sonos integration would end. Essentially useless to us now.,1,0,6.60.1,2025-01-17 22:29:54
0c62ca73-5339-44ea-8f83-84aaf6249063,Crystal,I have always loved this App!,5,0,,2025-01-17 15:57:02
a1c12459-85a8-4350-b0be-102b49316393,Charis Barnes,omg this is amazing 👏. I feel so much better after using it.,5,0,6.60.1,2025-01-17 13:34:58
387876e5-e9bc-426b-bff6-195853585895,Matthew Zellers,For a Calm app to reduce stress or anxiety it started with 3 pop-ups and a reminder for giving passes out. Not a great way to start,2,0,6.61,2025-01-17 10:57:50
a8ef2662-6824-4d32-b9d1-32dfc64bf899,Dave Giambattista,Has some good content but far too much is people talking. Can't seem to easily find something non verbal relaxing or calming when desired,3,0,6.60.1,2025-01-17 08:45:45
155782f4-d496-4450-84c6-11b6f8eba5bb,Olivier LAUDE (Olivier),"Watch out, if you are disappointed with the app, their cancellation process is made complicated, you have to click ""cancel subscription"" multiple times (at least 5 times)...and if you miss one, they make sure to charge you for the whole year. That cancellation process worries me, as if you are stressed or facing mental health struggle, no doubt you will miss a step The app is not worth it imo, Spotify has same stuff at half the cost or no cost if you already have a subscription like I do.",1,8,6.60.1,2025-01-17 05:44:17
5da372ba-fbb5-45d7-9e9e-6db84455c3ca,Nair Tavares,an amazing app to meditate but there's little titles for free it's a shame,4,0,6.60.1,2025-01-17 05:36:42
618ed0bf-0109-4dfa-9797-ef971e1660c6,Chris,*** NO LONGER WORKS WITH SONOS**** I have no use for this useless app anymore as I used it with my Sonos speakers. What a waste of money. I've asked for a refund as it's no longer fit for its purpose. What a scam,1,2,6.60.1,2025-01-17 05:07:18
ee802d16-5f42-4d64-bb5f-dd54fa36f05d,The Clayton Five,CALMING,5,0,6.60.1,2025-01-16 22:50:57
8e96c458-c60f-4688-95ed-253c05017f33,Lezlee P Schutte,Can't pay for it 😢,5,0,,2025-01-16 21:11:49
67f38d79-69a0-46c2-8da3-9c45520ecc10,Colin,The meditations are ABSOLUTELY incredible.,5,10,6.60.1,2025-01-16 19:40:08
